{
  "$schema": "https://json-schema.org/draft/2020-12/schema",
  "$id": "https://raw.githubusercontent.com/marcus-grant/normpic/main/schema/v0.1.0.json",
  "title": "NormPic Manifest v0.1.0",
  "description": "Schema for the NormPic manifest contract, v0.1.0. The authoritative semantic contract lives in doc/architecture/manifest-contract.md; this schema is the mechanical-validation half of the two-layer contract architecture. Rules that cannot be expressed in JSON Schema (e.g. the semantic equivalence of absent and null, producer style preferences, restrictions on '..' segments at non-leading positions in collection_root) are documented in the contract doc and enforced separately by implementations.",
  "type": "object",
  "required": [
    "version",
    "collection_name",
    "generated_at",
    "pic"
  ],
  "properties": {
    "version": {
      "$ref": "#/$defs/version"
    },
    "collection_name": {
      "$ref": "#/$defs/nonempty_string"
    },
    "collection_description": {
      "type": [
        "string",
        "null"
      ],
      "minLength": 1
    },
    "generated_at": {
      "$ref": "#/$defs/iso8601_utc_z"
    },
    "config": {
      "type": [
        "object",
        "null"
      ]
    },
    "collection_root": {
      "$ref": "#/$defs/collection_root"
    },
    "pic": {
      "type": "array",
      "items": {
        "$ref": "#/$defs/pic"
      }
    }
  },
  "additionalProperties": true,
  "$defs": {
    "version": {
      "type": "string",
      "minLength": 1,
      "pattern": "^[0-9]+\\.[0-9]+\\.[0-9]+$",
      "description": "Schema version, semver-shaped. Example: '0.1.0'."
    },
    "nonempty_string": {
      "type": "string",
      "minLength": 1
    },
    "iso8601_utc_z": {
      "type": "string",
      "minLength": 1,
      "pattern": "^[0-9]{4}-[0-9]{2}-[0-9]{2}T[0-9]{2}:[0-9]{2}:[0-9]{2}(?:\\.[0-9]+)?Z$",
      "description": "RFC 3339 UTC timestamp with mandatory 'Z' suffix. Fractional seconds optional. Offset variants like '+00:00' are NOT accepted."
    },
    "hash_b3c32": {
      "type": "string",
      "pattern": "^b3c32:[0-9ABCDEFGHJKMNPQRSTVWXYZ]{24}$",
      "description": "Content-addressed identity. Algorithm prefix 'b3c32:' followed by a 24-character Blake3 120 bit digest in Crockford Base32 uppercase canonical form. Crockford alphabet excludes I, L, O, U."
    },
    "relative_path": {
      "type": "string",
      "minLength": 1,
      "if": {
        "type": "string"
      },
      "then": {
        "allOf": [
          {
            "not": {
              "pattern": "^/"
            }
          },
          {
            "not": {
              "pattern": "^[A-Za-z]:"
            }
          },
          {
            "not": {
              "pattern": "/$"
            }
          },
          {
            "not": {
              "pattern": "//"
            }
          },
          {
            "not": {
              "pattern": "(?:^|/)\\.{1,2}(?:/|$)"
            }
          },
          {
            "not": {
              "pattern": "\\\\"
            }
          }
        ]
      },
      "description": "Path relative to the collection root. No leading slash or Windows drive (no absolute paths). No trailing slash. No empty segments. No '.' or '..' segments anywhere. No backslashes. UTF-8, NFC normalized (NFC enforced by implementations, not the schema)."
    },
    "collection_root": {
      "type": "string",
      "minLength": 1,
      "default": ".",
      "anyOf": [
        {
          "const": "."
        },
        {
          "if": {
            "type": "string"
          },
          "then": {
            "allOf": [
              {
                "not": {
                  "pattern": "^/"
                }
              },
              {
                "not": {
                  "pattern": "^[A-Za-z]:"
                }
              },
              {
                "not": {
                  "pattern": "/$"
                }
              },
              {
                "not": {
                  "pattern": "//"
                }
              },
              {
                "not": {
                  "pattern": "(?:^|/)\\.(?:/|$)"
                }
              },
              {
                "not": {
                  "pattern": "^[a-zA-Z][a-zA-Z0-9+\\-.]*:"
                }
              }
            ]
          }
        }
      ],
      "description": "Location of the collection root relative to the manifest file's directory. Default value '.' is emitted explicitly. Allows '..' segments at the start (zero or more), followed by zero or more non-special segments. The schema enforces no '.' segments, no aliasing constructs, and no leading URI schemes (e.g. 's3://', 'https://'). The additional restriction that '..' may not appear after the leading run is enforced by implementations. URI schemes are reserved for future versions."
    },
    "gps": {
      "type": "object",
      "required": [
        "lat",
        "lon"
      ],
      "properties": {
        "lat": {
          "type": "number",
          "minimum": -90,
          "maximum": 90
        },
        "lon": {
          "type": "number",
          "minimum": -180,
          "maximum": 180
        }
      },
      "additionalProperties": true,
      "description": "GPS coordinates. Latitude bounded [-90, 90], longitude bounded [-180, 180]."
    },
    "timestamp_source": {
      "type": [
        "string",
        "null"
      ],
      "enum": [
        "exif",
        "filename",
        "filesystem",
        "unknown",
        null
      ],
      "description": "Identifies how the timestamp was derived. May be null or absent for optional+nullable semantics."
    },
    "pic": {
      "type": "object",
      "required": [
        "hash",
        "relative_path",
        "size_bytes",
        "mtime"
      ],
      "properties": {
        "hash": {
          "$ref": "#/$defs/hash_b3c32"
        },
        "relative_path": {
          "$ref": "#/$defs/relative_path"
        },
        "original_filename": {
          "type": "string",
          "minLength": 1,
          "pattern": "^[^/\\\\]*$",
          "description": "Filename as found in source, with no path component. Optional, non-nullable: if present must be a non-empty string with no path separators (no '/' or '\\')."
        },
        "size_bytes": {
          "type": "integer",
          "minimum": 0,
          "description": "Source file size in bytes."
        },
        "mtime": {
          "$ref": "#/$defs/iso8601_utc_z"
        },
        "timestamp": {
          "oneOf": [
            {
              "type": "null"
            },
            {
              "$ref": "#/$defs/iso8601_utc_z"
            }
          ],
          "description": "Best-effort capture timestamp. Optional and nullable."
        },
        "timestamp_source": {
          "$ref": "#/$defs/timestamp_source"
        },
        "camera": {
          "type": [
            "string",
            "null"
          ],
          "minLength": 1,
          "description": "Camera model from EXIF. Optional and nullable. If present as a string, must be non-empty."
        },
        "gps": {
          "oneOf": [
            {
              "type": "null"
            },
            {
              "$ref": "#/$defs/gps"
            }
          ]
        },
        "tag": {
          "type": "array",
          "items": {
            "type": "string",
            "minLength": 1
          },
          "description": "Flat tag strings. Reserved in v0.1.0; NormPic does not populate this field. Singular per the ecosystem schema convention despite being array-typed. Each tag must be non-empty."
        }
      },
      "additionalProperties": true
    }
  }
}
