{
  "version": "0.1.0",
  "collection_name": "Lowercase Crockford Hash",
  "generated_at": "2025-06-15T12:00:00Z",
  "collection_root": ".",
  "pic": [
    {
      "hash": "b3c32:pzdre6bc90t0bs0fgg0zm7y9",
      "relative_path": "2024/IMG_0001.jpg",
      "original_filename": "IMG_0001.jpg",
      "size_bytes": 3145728,
      "mtime": "2024-09-14T10:23:00Z"
    }
  ]
}
