{
  "version": "0.1.0",
  "collection_name": "Traversal Root",
  "generated_at": "2025-06-15T12:00:00Z",
  "collection_root": "../..",
  "pic": [
    {
      "hash": "b3c32:PZDRE6BC90T0BS0FGG0ZM7Y9",
      "relative_path": "photos/IMG_0001.jpg",
      "size_bytes": 1024,
      "mtime": "2024-01-15T09:00:00Z"
    }
  ]
}
